{
  "$schema": "https://json-schema.org/draft/2020-12/schema",
  "$id": "https://schemas.axtro.ai/v2/derived_hypothesis.schema.json",
  "title": "Derived Hypothesis",
  "description": "An explicitly uncertain interpretation derived from perception signals.",
  "type": "object",
  "additionalProperties": false,
  "properties": {
    "schema_version": {
      "type": "string",
      "const": "2.0.0"
    },
    "hypothesis_id": {
      "type": "string",
      "pattern": "^[0-9a-f]{8}-[0-9a-f]{4}-7[0-9a-f]{3}-[89ab][0-9a-f]{3}-[0-9a-f]{12}$"
    },
    "session_id": {
      "type": "string",
      "pattern": "^[0-9a-f]{8}-[0-9a-f]{4}-7[0-9a-f]{3}-[89ab][0-9a-f]{3}-[0-9a-f]{12}$"
    },
    "tenant_id": {
      "type": "string",
      "pattern": "^[0-9a-f]{8}-[0-9a-f]{4}-7[0-9a-f]{3}-[89ab][0-9a-f]{3}-[0-9a-f]{12}$"
    },
    "label": {
      "type": "string",
      "minLength": 1,
      "maxLength": 160
    },
    "statement": {
      "type": "string",
      "minLength": 1,
      "maxLength": 1500
    },
    "evidence_signal_ids": {
      "type": "array",
      "items": {
        "type": "string",
        "pattern": "^[0-9a-f]{8}-[0-9a-f]{4}-7[0-9a-f]{3}-[89ab][0-9a-f]{3}-[0-9a-f]{12}$"
      },
      "minItems": 1,
      "maxItems": 100
    },
    "confidence": {
      "type": "number",
      "minimum": 0,
      "maximum": 1
    },
    "status": {
      "type": "string",
      "enum": [
        "candidate",
        "active",
        "confirmed",
        "rejected",
        "expired"
      ]
    },
    "allowed_use": {
      "type": "string",
      "enum": [
        "turn_strategy",
        "clarification",
        "accessibility",
        "quality",
        "safety",
        "prohibited"
      ]
    },
    "created_at": {
      "type": "string",
      "format": "date-time"
    },
    "expires_at": {
      "type": "string",
      "format": "date-time"
    }
  },
  "required": [
    "schema_version",
    "hypothesis_id",
    "session_id",
    "tenant_id",
    "label",
    "statement",
    "evidence_signal_ids",
    "confidence",
    "status",
    "allowed_use",
    "created_at",
    "expires_at"
  ]
}
