{
  "schema_version": "2.0.0",
  "hypothesis_id": "018f1e2d-3c4b-7a06-8c9d-00112233445a",
  "session_id": "018f1e2d-3c4b-7a02-8c9d-001122334456",
  "tenant_id": "018f1e2d-3c4b-7a01-8c9d-001122334455",
  "label": "possible_confusion",
  "statement": "O participante pode precisar de uma explicação mais simples.",
  "evidence_signal_ids": [
    "018f1e2d-3c4b-7a05-8c9d-001122334459"
  ],
  "confidence": 0.72,
  "status": "active",
  "allowed_use": "clarification",
  "created_at": "2026-07-14T20:00:00Z",
  "expires_at": "2026-07-14T21:00:00Z"
}
